,product_id,title,authors,original_price,current_price,quantity,category,n_review,avg_rating,pages,manufacturer,cover_link,discount
445,54053521,Hội Chứng E,Franck Thilliez,7.55,4.53,1270,Truyện trinh thám,300,4.7,484,Nhà Xuất Bản Hội Nhà Văn,https://salt.tikicdn.com/ts/product/97/33/93/91d41c482121a3d37803c341087dc9b7.jpg,0.4
446,201580268,Đau – Sự Cứu Rỗi Nơi Tận Cùng Đau Thương,Tôn Tần,6.41,5.02,78,Truyện trinh thám,7,4.6,384,Nhà Xuất Bản Thanh Niên,https://salt.tikicdn.com/ts/product/6c/fb/6b/46c65e5ef1a90a9c12231700e26944cd.jpg,0.22
447,92732216,Những Kẻ Xuất Chúng (Tái Bản),Malcolm Gladwell,6.71,4.43,1869,Sách kinh tế học,301,5.0,416,Nhà Xuất Bản Thế Giới,https://salt.tikicdn.com/ts/product/74/01/53/2fd820f97ed68509c207df6376b81249.jpg,0.34
448,196932362,Đấng cứu thế,Jo Nesbø,10.93,7.38,236,Truyện trinh thám,32,5.0,560,Nhà Xuất Bản Hà Nội,https://salt.tikicdn.com/ts/product/d8/39/9c/6a9ff77726165f6ddbf7e6ba30d7a775.jpg,0.32
449,112825941,Sự An Ủi Của Triết Học,Alain de Botton,4.6,2.76,615,Others,86,4.8,336,Nhà Xuất Bản Thế Giới,https://salt.tikicdn.com/ts/product/f3/5d/b2/4bb1e2c5e2d544d06c33079479b58e22.jpg,0.4
450,168662558,CCMR. Phải Trái Đúng Sai,Michael Sandel,6.54,4.1,591,Others,83,5.0,402,NXB Trẻ,https://salt.tikicdn.com/ts/product/40/bf/63/980deeb76442bca207341dc948e2022c.jpg,0.37
451,202891560,Tâm Lý Học Giải Mã Tình Yêu,Logan Ury,5.02,3.61,97,Lĩnh vực khác,5,5.0,300,Nhà Xuất Bản Thế Giới,https://salt.tikicdn.com/ts/product/8d/7f/b1/edb4d762b131d9cea4b685f6264b5b6d.png,0.28
452,111153025,Sách: 1 Ngày Bằng 48 Giờ - Sổ tay Quản Lí Thời Gian Hiệu Quả ,Instant Research Institude,3.04,2.26,991,Others,139,5.0,208,Nhà Xuất Bản Thanh Niên,https://salt.tikicdn.com/ts/product/02/4f/26/6e55aa0ef5e8191b7a58d6069bf5b3ed.jpg,0.26
453,103640412,Đừng Lựa Chọn An Nhàn Khi Còn Trẻ (Tái Bản),Cảnh Thiên,4.18,2.91,8291,Others,1581,4.8,316,Nhà Xuất Bản Thế Giới,https://salt.tikicdn.com/ts/product/c9/19/bb/f38df394d296929b86b49a72ca89a12e.jpg,0.3
454,202895291,Lịch Sử Cái Đẹp,Vĩ Ngư,19.37,11.62,141,Lĩnh vực khác,14,4.6,439,Nhà Xuất Bản Thế Giới,https://salt.tikicdn.com/ts/product/dc/50/b0/5f39c9eb5586964461ef8d374e1e8484.jpg,0.4
455,540039,Giáo Trình Chuẩn HSK 1 - Bài Học (Kèm file MP3),Khương Lệ Bình,8.35,5.76,6022,Sách Học Tiếng Hoa,810,4.8,144,Nhà Xuất Bản Tổng hợp TP.HCM,https://salt.tikicdn.com/ts/product/92/37/db/3e0bd4d2f16e4e5fa8d1c8cc59b55506.jpg,0.31
456,201004702,"Tình Đầu Chọn Tôi, Tôi Rất Ngọt",Thụy Mang,7.13,5.27,378,Truyện đam mỹ,96,4.8,528,Nhà Xuất Bản Hà Nội,https://salt.tikicdn.com/ts/product/38/50/f2/d663f97d3f49932cbd5a0fd9c31cec83.jpg,0.26
457,109505434,Bạn Không Thông Minh Lắm Đâu (Tái Bản)(Tặng kèm Bookmark),David McRaney,5.86,4.98,2802,Others,0,0.0,410,Nhà Xuất Bản Thế Giới,https://salt.tikicdn.com/ts/product/53/ec/cf/cee2670564510b7c646c6c3bf03c5bf5.jpg,0.15
458,77225336,Miếng Ngon Hà Nội (Việt Nam Danh Tác),Vũ Bằng,2.95,1.77,911,Tiểu Thuyết,171,5.0,212,Nhà Xuất Bản Hội Nhà Văn,https://salt.tikicdn.com/ts/product/6e/64/b5/0dfef9dbaf85a85f2f7038ceed68e0cc.jpg,0.4
459,204665316,"Chúng Ta Sống, Là Vì…?",Nguyễn Phong Việt,4.18,3.33,91,Truyện ngắn - Tản văn - Tạp Văn,1,5.0,184,Nhà Xuất Bản Thế Giới,https://salt.tikicdn.com/ts/product/5a/7b/26/c35d1758256972abe139f7dde3c42cf6.png,0.2
460,1471887,Tớ Muốn Ăn Tụy Của Cậu,Sumino Yoru,4.05,2.43,4656,Tiểu Thuyết,634,4.6,344,Unknown,https://salt.tikicdn.com/ts/product/90/c4/cd/d4f85346e6b17cf2f40bea1d36c8d543.jpg,0.4
461,58213080,Montessori – Phương Pháp Giáo Dục Toàn Diện Cho Trẻ 0-6 Tuổi,Ito Mika,5.02,3.54,2624,Sách Làm Cha Mẹ,334,5.0,240,Nhà Xuất Bản Dân Trí,https://salt.tikicdn.com/ts/product/b8/bb/00/d0c7aaa2f74d54070598ce279fa0f99e.jpg,0.29
462,173745189,Clean Code – Mã Sạch Và Con Đường Trở Thành Lập Trình Viên Giỏi,Robert Cecil Martin,16.29,12.78,340,Others,61,4.7,596,Nhà Xuất Bản Dân Trí,https://salt.tikicdn.com/ts/product/d0/17/b6/eebfb0d12e13ec120448f84e669a4f11.jpg,0.22
463,113530804,Nếu Em Không Phải Giấc Mơ (Tái Bản),Marc Levy,3.76,2.25,210,Tiểu Thuyết,31,4.8,301,Nhà Xuất Bản Hội Nhà Văn,https://salt.tikicdn.com/ts/product/7f/b3/dd/ea7881f057a71f637bbb7449b69f7754.jpg,0.4
464,195801686,Black Jack - Tập 13 (Bìa Mềm),Osamu Tezuka,1.27,1.1,666,Others,59,5.0,456,NXB Trẻ,https://salt.tikicdn.com/ts/product/50/28/1a/950e5ca1065b896a547f067d23089620.jpg,0.13
465,104074993,Nhảy Nhảy Nhảy (Tái Bản),Haruki Murakami,7.13,4.28,802,Truyện Giả tưởng - Huyền Bí - Phiêu Lưu,175,5.0,568,Nhà Xuất Bản Hội Nhà Văn,https://salt.tikicdn.com/ts/product/a0/3a/ef/c1efb6857cfae62505d79ab026cc4054.jpg,0.4
466,10379317,Nghệ Thuật Giao Tiếp Để Thành Công (Tái Bản 2019),Leil Lowndes,7.13,4.68,5489,Others,568,4.8,440,Unknown,https://salt.tikicdn.com/ts/product/f9/92/90/b48d511f27288fe28df633e5ea4911cf.jpg,0.34
467,203757842,Migi & Dali - Tập 6,Nami Sano,1.69,1.61,169,Others,10,5.0,456,Nhà Xuất Bản Kim Đồng,https://salt.tikicdn.com/ts/product/4a/a6/1a/c1f8717e9ec491f1b3a83b0dfc87a4b6.jpg,0.05
468,41299108,Trở Về Từ Cõi Sáng (Tái Bản),Nguyên Phong,4.14,2.73,5353,Others,564,4.8,208,Unknown,https://salt.tikicdn.com/media/catalog/producttmp/4f/e8/a1/c5199b53371791ba5470cba2aa70b8ab.jpg,0.34
469,27589910,"Bố Xấu, Bố Tốt",David Walliams,5.4,4.26,1521,Văn học thiếu nhi,129,4.8,444,Unknown,https://salt.tikicdn.com/ts/product/48/d2/d2/4833023359d3095c22874f8deeb13f55.jpg,0.21
470,152875147,Miền Đất Hứa - Barack Obama (Bìa Cứng),Barack Obama,32.41,14.26,1841,Tiểu sử - Hồi ký,228,5.0,1072,Nhà Xuất Bản Dân Trí,https://salt.tikicdn.com/media/catalog/producttmp/02/bd/ac/478941003fc6487dc2049e2f5f2f3e3a.jpg,0.56
471,425716,Atlas Giải Phẫu Cơ Thể Người,BS. Alice Roberts,28.69,22.95,122,Others,16,5.0,512,Nhà Xuất Bản Dân Trí,https://salt.tikicdn.com/media/catalog/product/1/_/1._atlas_giai_phau_nguoi.jpg,0.2
472,40052042,Đọc Vị Bất Kỳ Ai (Tái Bản 2019),TS. David J. Lieberman,3.33,2.33,18965,Others,2420,4.8,223,Unknown,https://salt.tikicdn.com/ts/product/42/a2/bf/ee69391ec908fc263af39a3a32983706.jpeg,0.3
473,50269973,Biểu Tượng Thất Truyền (Tái Bản 2020),Dan Brown,9.24,6.54,1351,Truyện trinh thám,312,4.7,756,Nhà Xuất Bản Lao Động,https://salt.tikicdn.com/ts/product/26/c2/37/d755b97be5fdf04d7326f08c71847513.jpg,0.29
474,34267257,Nhân tố Enzyme - Phương Thức Sống Lành Mạnh (Tái Bản 2019),Hiromi Shinya,3.76,2.63,11445,Others,1343,4.8,224,Unknown,https://salt.tikicdn.com/ts/product/fa/d3/66/073eaa1733569ac02c3984990089fc0d.jpg,0.3
475,203231461,SIGNS Thông Điệp Bí Ẩn Từ Vũ Trụ,Laura Lynne Jackson,5.44,4.03,65,Lĩnh vực khác,4,4.8,376,Nhà Xuất Bản Thanh Niên,https://salt.tikicdn.com/ts/product/c2/c4/40/59fe4d7eca161347b85eb5166c8950aa.png,0.26
476,207475552,Vua Sáng Chế Tập 23,Tatsuki Nohda,0.84,0.84,34,Others,4,5.0,192,Nhà Xuất Bản Kim Đồng,https://salt.tikicdn.com/ts/product/87/b8/78/f300ec5fefe5459b40090d63273f4ab0.jpg,0.0
477,205942265,Infinite Dendrogram 3 - Đại Chiến Siêu Cấp,Kaidou Sakon,5.49,3.29,45,Light novel,8,5.0,352,Nhà Xuất Bản Hà Nội,https://salt.tikicdn.com/ts/product/b1/c7/97/c1eda81ba4acbdc80316991d233a96ba.jpg,0.4
478,205423656,Nhân Duyên Tiền Kiếp,Unknown,8.23,8.23,2802,Others,0,0.0,456,Nhà Xuất Bản Thanh Niên,https://salt.tikicdn.com/ts/product/12/12/90/21d482d8a69ed6e77d2ab3b232ca7159.jpg,0.0
479,17960478,RIO Book No.3 - Hình Ảnh Điều Khiển Tâm Trí - 33 Kỹ Thuật Điều Khiển Tâm Lý Trong Truyền Thông Thị Giác,Andrews - Van leeuwen - Van Baaren ,6.54,4.58,2127,Sách Marketing - Bán hàng ,213,4.8,456,Nhà Xuất Bản Dân Trí,https://salt.tikicdn.com/ts/product/4b/0c/87/40e137565d61b3c3504e53afc43265e9.jpg,0.3
480,178483637,Nước Ép Trị Liệu Và Chế Độ Ăn Theo Phương Pháp Cơ Thể Tự Chữa Lành,Emma Phạm,8.4,5.88,1792,Others,219,5.0,340,Nhà Xuất Bản Thế Giới,https://salt.tikicdn.com/ts/product/ce/03/a6/03cea0cb853c06293f9e178896b50f6c.jpg,0.3
481,94803499,Rừng Sâu Tăm Tối,Ruth Ware,6.96,6.61,11,Tiểu Thuyết,5,4.8,432,Nhà Xuất Bản Hội Nhà Văn,https://salt.tikicdn.com/ts/product/ae/8a/c9/60457050a34cad60febda55f02bc0285.jpg,0.05
482,480687,Vô Thường,Nguyễn Bảo Trung,3.33,2.19,10187,Truyện ngắn - Tản văn - Tạp Văn,707,4.8,216,Unknown,https://salt.tikicdn.com/ts/product/51/cf/19/024f4bacf6c38c06fb537dc41cced5ad.jpg,0.34
483,66067655,Trải Nghiệm Khách Hàng Xuất Sắc,Nguyễn Dương,10.55,7.07,8054,"Sách quản trị, lãnh đạo",810,5.0,344,Nhà Xuất Bản Thế Giới,https://salt.tikicdn.com/ts/product/1c/fb/b8/f924b4eff4598c5fc7b511be448caa95.jpg,0.33
484,45321628,Tiệm Bá Nghệ Tada Trước Ga Mahoro,Miura Shion,5.06,3.04,685,Tiểu Thuyết,95,5.0,340,Nhà Xuất Bản Dân Trí,https://salt.tikicdn.com/ts/product/22/48/d1/b4f5f0fa9a8394d02b021c1557ed99ae.jpg,0.4
485,20917699,Làm Sao Học Ít Hiểu Nhiều,Zion Kabasawa,5.4,3.62,2703,Others,478,4.8,272,Unknown,https://salt.tikicdn.com/ts/product/6d/af/9c/55a1d35282f15a0d0b9ce65879d946b1.png,0.33
486,69644748,Thiền Sư Và Em Bé 5 Tuổi,Thích Nhất Hạnh,5.06,3.39,3869,Others,594,5.0,232,Nhà Xuất Bản Dân Trí,https://salt.tikicdn.com/ts/product/40/50/4f/c66154af241f021f345fb3c53a70f57d.jpg,0.33
487,205757105,Komi - Nữ Thần Sợ Giao Tiếp Tập 15,Tomohito Oda,1.05,0.97,98,Others,8,4.6,192,Nhà Xuất Bản Kim Đồng,https://salt.tikicdn.com/ts/product/8d/1b/d9/774fd3a4ff41ac77a9ef71f60027927f.jpg,0.08
488,8886005,Bay Trên Tổ Chim Cúc Cu (Tái Bản),Ken Kesey,4.98,2.99,2499,Truyện dài,277,4.8,456,Unknown,https://salt.tikicdn.com/ts/product/a9/ab/1d/a621797c725c3f6ed04c957dec333a50.jpg,0.4
489,66712456,Trở Về Không - Trải Nghiệm Ho'oponopono - Thực Hiện Hóa Những Phép Màu Trong Cuộc Sống,Joe Vitale,6.71,4.52,5119,Others,836,5.0,340,Nhà Xuất Bản Thế Giới,https://salt.tikicdn.com/ts/product/ba/c3/dd/5727b66b1f6101d87ae956e32ee1650b.jpg,0.33
490,129381090,Minh Triết Trong Đời Sống (Tái Bản),Darshani Deane,4.56,3.0,1006,Others,138,5.0,288,Nhà Xuất Bản Thế Giới,https://salt.tikicdn.com/media/catalog/producttmp/b0/d2/e1/5ab40fd6e45ff9c1bcbb67867f8ef022.jpg,0.34
491,3644267,Đặc Quyền Của Gái Hư,Kara King,3.63,2.83,15646,Others,572,4.6,284,Unknown,https://salt.tikicdn.com/ts/product/15/f5/60/17597afdd03ec3b704ab0d7f005a19a1.jpg,0.22
492,7326881,Những Nguyên Tắc Đạo Đức Trong Giáo Dục,John Dewey,2.11,2.11,3,Others,0,0.0,96,Nhà Xuất Bản Đà Nẵng,https://salt.tikicdn.com/ts/product/b7/01/2c/cab251d6c4aa9aae75530430e0515227.jpg,0.0
493,198419657,Chú Thuật Hồi Chiến - Tập 7,Unknown,1.27,1.27,2447,Others,584,5.0,456,Nhà Xuất Bản Kim Đồng,https://salt.tikicdn.com/ts/product/6b/98/82/8d6ef80eb54c5fb1e2d8f6e74de9ca6c.jpg,0.0
494,177321531,"Súng, Vi Trùng Và Thép",Jared Diamond,12.62,8.19,415,Kiến Thức Bách Khoa,63,5.0,660,Nhà Xuất Bản Thế Giới,https://salt.tikicdn.com/ts/product/e1/19/fe/ca5bbc6af530dfb61b319ad9200b33ab.jpg,0.35
495,205802190,Thám Tử Lừng Danh Conan - Tập 100 - Bìa Gập - Tặng Kèm Postcard Vuông Conan 100,Gosho Aoyama,0.84,0.84,79,Others,6,5.0,456,Nhà Xuất Bản Kim Đồng,https://salt.tikicdn.com/ts/product/86/f3/ba/989cb5a603f5d7ad1078cdae574b038c.jpg,0.0
496,198127380,Harry Potter và Hội Phượng Hoàng - Bản Màu Bìa Cứng,J.K. Rowling,63.29,44.33,303,Truyện Giả tưởng - Huyền Bí - Phiêu Lưu,59,4.8,456,NXB Trẻ,https://salt.tikicdn.com/ts/product/4e/4f/ab/9901cdbc0d96d3c1152b124608355a22.jpg,0.3
497,76278485,Ảo Dạ (Tái Bản),Higashino Keigo,7.55,4.53,817,Truyện trinh thám,206,5.0,584,Nhà Xuất Bản Hà Nội,https://salt.tikicdn.com/ts/product/9e/01/6f/a0bb7085a45d4cda06c7424c5288b35b.jpg,0.4
498,50668886,"Thiện, Ác Và Smart Phone (Tái Bản)",Đặng Hoàng Giang,4.43,2.66,2124,Others,371,5.0,307,Nhà Xuất Bản Hội Nhà Văn,https://salt.tikicdn.com/ts/product/ad/12/d9/b32db899a0c2cd01d4e6f5878ce993b4.jpg,0.4
499,46253703,Danh Gia Cổ Vật - Bí Ẩn Thanh Minh Thượng Hà Đồ,Mã Bá Dung,6.33,3.16,1736,Truyện Giả tưởng - Huyền Bí - Phiêu Lưu,285,4.8,528,Nhà Xuất Bản Hội Nhà Văn,https://salt.tikicdn.com/ts/product/dd/a3/d8/baeb9c8c72e7052cf82e81798f0ca2ad.jpg,0.5
500,179546074,Luật Hấp Dẫn - Quy Luật Về Sự Thịnh Vượng Và Thành Công,Prentice Mulford,5.44,3.5,446,Others,40,4.7,260,Nhà Xuất Bản Thanh Niên,https://salt.tikicdn.com/ts/product/67/36/ef/eafef30d7bc5df494f7613c75e605aa3.png,0.36
501,56218385,Thông Điệp Của Nước (Tái Bản 2020),Masaru Emoto,3.76,2.63,2957,Others,406,4.7,146,Nhà Xuất Bản Lao Động,https://salt.tikicdn.com/ts/product/8c/c2/bb/4c42dfafcccf543a28268853299fc98c.jpg,0.3
502,76286239,Súng Săn,Yasushi Inoue,3.33,1.33,237,Tiểu Thuyết,32,4.8,104,Nhà Xuất Bản Hội Nhà Văn,https://salt.tikicdn.com/ts/product/37/a7/c0/b37564d7964fcb9be6356073e9bf1a64.jpg,0.6
503,94173462,Muôn Kiếp Nhân Sinh 2,Nguyên Phong,11.31,7.46,23606,Others,5447,5.0,540,Nhà Xuất Bản Tổng hợp TP.HCM,https://salt.tikicdn.com/media/catalog/producttmp/ae/be/1f/2d1524717e634872a1dc861020a70b2b.jpg,0.34
504,202015697,Văn Phòng Thám Tử Quái Vật - Tập 15,Sho Aimoto,1.27,1.1,209,Others,24,5.0,456,NXB Trẻ,https://salt.tikicdn.com/ts/product/65/b8/95/8ef0893e9d03e1b3f9740891c2a47258.jpg,0.13
505,203763653,Vivre Card - Thẻ Dữ Liệu Nhân Vật One Piece Booster Pack - Kẻ Chi Phối Đáng Sợ! Gia Tộc Donquixote!!,Unknown,1.05,1.05,148,Others,11,5.0,456,Nhà Xuất Bản Kim Đồng,https://salt.tikicdn.com/ts/product/fe/ba/0e/ebde15d658bb546bfc1ad54cf0de69f5.jpg,0.0
506,750578,Khi Hơi Thở Hóa Thinh Không,Paul Kalanithi,4.6,2.9,59734,Tiểu sử - Hồi ký,2099,4.7,236,Unknown,https://salt.tikicdn.com/media/catalog/product/k/h/khi-hoi-tho-hoa-thinh-khong.u5464.d20170726.t170655.288851.jpg,0.37
507,124767704,Bạn Đắt Giá Bao Nhiêu? (Tái Bản),Vãn Tình,5.02,3.97,1574,Others,257,4.8,336,Nhà Xuất Bản Thế Giới,https://salt.tikicdn.com/ts/product/39/02/81/44315fecbd95af078d1abbdc359e1794.jpg,0.21
508,35785372,Y Học Dinh Dưỡng - Những Điều Bác Sĩ Không Nói Với Bạn,Unknown,7.13,4.64,4568,Others,458,4.8,456,Unknown,https://salt.tikicdn.com/ts/product/83/2e/c3/c5ae4fe0dab21acd452f4ac5e4a69128.jpg,0.35
509,200619302,Anh em phi hành gia - Tập 35,Chuya Koyama,1.9,1.65,220,Others,16,4.8,204,NXB Trẻ,https://salt.tikicdn.com/ts/product/3c/d4/ac/1e219fb1e145f693df1edaa57d958621.jpg,0.13
510,138226289,Storytelling With Data: Let’S Practice! - Thực Hành Kể Chuyện Thông Qua Dữ Liệu!,Cole Nussbaumer Knaflic,16.84,11.77,1472,Sách kỹ năng làm việc,239,5.0,436,Nhà Xuất Bản Thế Giới,https://salt.tikicdn.com/ts/product/3c/d7/33/63679b6e74378c4282ddd5534501c916.jpg,0.3
511,66452062,Trái Tim Của Brutus,Higashino Keigo,5.82,3.49,2247,Truyện trinh thám,465,4.8,348,Nhà Xuất Bản Hà Nội,https://salt.tikicdn.com/ts/product/a4/e4/fe/4d9a4d7f7ef61418698c1126858a0403.jpg,0.4
512,90985718,"Càng Mạnh Mẽ, Càng Dịu Dàng (Tái Bản)",Lý Ái Linh,4.18,2.7,1473,Others,187,5.0,352,Nhà Xuất Bản Hội Nhà Văn,https://salt.tikicdn.com/ts/product/c9/32/14/6b2d50f1ace01d021d051d083d36feb4.jpg,0.35
513,200619298,"Gửi em, người bất tử - Tập 13",Yoshitoki Oima,1.27,1.1,280,Others,33,5.0,192,NXB Trẻ,https://salt.tikicdn.com/ts/product/6c/c1/61/3def09d07bdb93e8fb3c583c1ae273c8.jpg,0.13
514,202153825,Vì Con Gái Tôi Có Thể Đánh Bại Cả Ma Vương - Tập 6,CHIROLU,5.91,4.26,434,Light novel,86,5.0,384,Nhà Xuất Bản Phụ Nữ Việt Nam,https://salt.tikicdn.com/ts/product/a6/1f/81/cd7c128b9d5e5eeb899031af373e6ba3.jpg,0.28
515,199045170,Dragon Ball Full Color - Phần Năm: Truy Lùng Cell Bọ Hung - Tập 5,Akira Toriyama,3.25,2.96,437,Others,48,5.0,224,Nhà Xuất Bản Kim Đồng,https://salt.tikicdn.com/ts/product/70/92/91/b43ed888c489e04cb2e0a9ee81ad7dd7.jpg,0.09
516,7544175,Một Trăm Cái Bóng,Hwang Jungeun,2.95,2.19,848,Tiểu Thuyết,37,4.8,148,Unknown,https://salt.tikicdn.com/ts/product/18/52/da/e45622ee97cad8aa71de727041abf746.jpg,0.26
517,74981856,"Gửi Bạn, Người Đã Kiệt Sức Vì Những Chịu Đựng Âm Thầm [Tặng Kèm: 1 Bookmark Daisy]",Geulbaewoo,4.05,2.62,2883,Truyện ngắn - Tản văn - Tạp Văn,668,5.0,284,Nhà Xuất Bản Thế Giới,https://salt.tikicdn.com/ts/product/d6/f2/82/762baed33a7738d12dd388e95002f369.jpg,0.35
518,201892202,Anh Em Phi Hành Gia - Tập 36,Chuya Koyama,1.9,1.52,149,Others,12,5.0,456,NXB Trẻ,https://salt.tikicdn.com/ts/product/99/ee/e3/ef17a669e205cb28c22d137f30bd17f3.jpg,0.2
519,173882437,8 Vụ Án Hoàn Hảo - Vạch Trần Tâm Lý Kẻ Phạm Tội,Peter Swanson,6.12,4.39,1496,Others,329,4.8,296,Nhà Xuất Bản Thanh Niên,https://salt.tikicdn.com/ts/product/56/9b/2a/d2e9df5c0087157ddbaa04dd66f39159.jpg,0.28
520,44433397,"Yêu Mình Trước Đã, Yêu Đời Để Sau",Vex King,4.6,2.95,5252,Others,597,4.8,343,Unknown,https://salt.tikicdn.com/ts/product/4f/d0/e7/304dc60d09641635b64a932b54ff54af.jpg,0.36
521,173763072,Tâm Lý Học Hẹn Hò - Nghệ Thuật Giao Tiếp Trong Tình Yêu,Nhiều tác giả,4.6,3.21,1336,Others,142,4.8,280,Nhà Xuất Bản Dân Trí,https://salt.tikicdn.com/ts/product/83/e2/62/649a2a3335e07bc133cf1e8b5adc29f4.jpg,0.3
522,204985083,Gia Định Là Nhớ Sài Gòn Là Thương_FN,Cù Mai Công,4.98,4.43,153,Others,15,5.0,226,Nhà Xuất Bản Tổng hợp TP.HCM,https://salt.tikicdn.com/ts/product/82/87/62/69278f63e4a8a667c4c67c7a45c25e53.jpg,0.11
523,207494302,Tiểu Thuyết One Piece Film RED [Tặng Kèm Bìa Áo Và Poster Gập Sẵn Bên Trong],Eiichiro Oda,2.74,2.74,46,Others,8,5.0,244,Nhà Xuất Bản Kim Đồng,https://salt.tikicdn.com/ts/product/4e/b3/7a/7aa1b8e0b2c4082fab0e1973f5b6830b.jpg,0.0
524,177321527,Cường Quốc Trong Tương Lai,Hamada Kazuyuki,5.02,3.13,148,Sách kinh tế học,17,5.0,280,Nhà Xuất Bản Thế Giới,https://salt.tikicdn.com/ts/product/e0/4e/0d/8c5f132b21736262f12a5ee290554250.jpg,0.38
525,130233544,Mèo Và Triết Lý Nhân Sinh - Mèo Đã Dạy Chúng Ta Điều Gì Về Cuộc Sống,John Gray,8.82,5.78,2672,Others,417,4.8,276,Nhà Xuất Bản Thanh Niên,https://salt.tikicdn.com/ts/product/ef/cb/f4/767561983136b09005c54fc877189af3.jpg,0.34
526,198415075,Ikigami - Tập 10,Motoro MASE,1.9,1.65,287,Others,25,5.0,456,NXB Trẻ,https://salt.tikicdn.com/ts/product/ca/c2/00/aa9668c548f92f586105a367264fb5c6.jpg,0.13
527,206308045,Yu-Gi-Oh! Gx Tập 3: Vòng Bảng Kết Thúc!! [Tặng Kèm Bookmark PVC],Kazuki Takahashi,1.27,1.23,74,Others,6,4.8,192,Nhà Xuất Bản Kim Đồng,https://salt.tikicdn.com/ts/product/c9/a6/a7/3c649431f124d0646d38382303f72790.jpg,0.03
528,12055610,Bàn Về Khoa Học,Leon Tolstoy,2.11,1.9,9,Kiến Thức Bách Khoa,0,0.0,80,Unknown,https://salt.tikicdn.com/ts/product/f4/a8/dc/7da52979aa5c1533b74471e1b7de4e31.jpg,0.1
529,196515658,Blue Period - Tập 04,Yasuhisa Hara,2.03,1.62,683,Others,109,5.0,456,NXB Trẻ,https://salt.tikicdn.com/ts/product/0b/47/a6/c0c6b79d8894219acaa53815f9ea9a22.jpg,0.2
530,192733741,Mùi hương - Tái Bản,Patrick Suskind,4.85,2.91,160,Tác phẩm kinh điển,24,5.0,456,Nhà Xuất Bản Văn Học,https://salt.tikicdn.com/ts/product/1b/a6/d3/07effba774f36348076d35092592b996.jpg,0.4
531,73316977,Hành Trình Của Linh Hồn (Tái Bản 2020),Michael Duff Newton,5.44,3.81,1874,Others,281,4.8,430,Nhà Xuất Bản Văn Hoá Dân Tộc,https://salt.tikicdn.com/ts/product/d2/52/b5/b4c0bffcf1f5006a3420ac2ffd63e8f3.jpg,0.3
532,2216865,Pierre Và Jean,Guy De Maupassant,2.87,2.26,447,Tiểu Thuyết,35,4.8,236,Unknown,https://salt.tikicdn.com/ts/product/07/43/77/d40843de68c0ce87be09728722bd180e.jpg,0.21
533,202466690,"Cao Thủ ""Đổi Đen Thay Trắng"" - Tập 7",Phong Thư Lưu Ngốc,6.71,6.71,167,Truyện đam mỹ,40,5.0,408,Nhà Xuất Bản Hà Nội,https://salt.tikicdn.com/ts/product/87/80/55/87d190955fb4ab5962c7332894a9c45c.jpg,0.0
534,57905707,Chữ Số Và Thế Giới - Nguồn Gốc Bị Lãng Quên,Đỗ Minh Triết,6.12,4.51,1884,Lĩnh vực khác,314,4.8,420,Nhà Xuất Bản Hà Nội,https://salt.tikicdn.com/ts/product/14/72/41/38147755c1fe42d4de8d2d4de3227a59.jpg,0.26
535,13624088,Nghĩ Thiện Để Cuộc Đời Và Công Việc Viên Mãn,Inamori Kazuo,2.95,2.37,3213,Others,206,4.8,196,Unknown,https://salt.tikicdn.com/ts/product/0d/30/92/e49d2293c601bb8db2164ee14f7a8f3e.jpg,0.2
536,108684605,Trí Thông Minh Của Sự Tinh Tế,Tô Mạn,3.76,2.66,2676,Others,395,4.8,230,Nhà Xuất Bản Phụ Nữ Việt Nam,https://salt.tikicdn.com/ts/product/b8/d0/4d/e228d7481152597d9bbce83759866898.jpg,0.29
537,205576473,Đế Quốc Bóng Tối,Tiêu Đường Đông Qua,10.08,6.76,99,Truyện đam mỹ,18,5.0,520,Nhà Xuất Bản Hà Nội,https://salt.tikicdn.com/ts/product/66/7e/08/af39c4a1469dd8233fb9b3c8081b9213.jpg,0.33
538,196517620,Điểm Đến Cuộc Đời,Đặng Hoàng Giang,3.8,2.28,55,Others,5,5.0,236,Nhà Xuất Bản Hội Nhà Văn,https://salt.tikicdn.com/ts/product/5b/f0/8f/b672b98a1944a98c87667497d5e18421.jpg,0.4
539,197781972,Đi Hát Karaoke Đi,Yama Wayama,2.11,1.48,513,Others,88,5.0,164,Nhà Xuất Bản Kim Đồng,https://salt.tikicdn.com/ts/product/64/75/30/6ddc9be10f3cc9685f811671cee6290f.jpg,0.3
540,199739996,Triệu Dấu Chân Qua Những Cửa Ô,Nguyễn Trương Quý,6.75,4.05,84,Truyện ngắn - Tản văn - Tạp Văn,3,5.0,388,Nhà Xuất Bản Phụ Nữ,https://salt.tikicdn.com/ts/product/c7/b6/0a/e4c55a3929508f04a0270f5ac681f191.jpg,0.4
541,106863962,Bên Rặng Tuyết Sơn (Tái Bản),Nguyên Phong,4.98,2.84,1056,Others,174,5.0,216,Nhà Xuất Bản Thế Giới,https://salt.tikicdn.com/media/catalog/producttmp/59/f8/06/4db822daa293142f0eb74492f5f9c96c.jpg,0.43
542,146223395,Cách thức kinh doanh và đầu cơ cổ phiếu! – How to Trade in Stocks,Richard Smitten,14.73,14.73,3458,"Sách tài chính, tiền tệ",721,4.8,320,Nhà Xuất Bản Thế Giới,https://salt.tikicdn.com/ts/product/ec/7c/d4/d0150504bb477e8bcb22a0a205829cea.jpg,0.0
543,200672813,Combo Sách Seneca: Những Bức Thư Đạo Đức Tập 1 + Tập 2,Lucius Annaeus Seneca,13.0,13.0,1,Sách nghệ thuật sống đẹp,0,0.0,894,Nhà Xuất Bản Thế Giới,https://salt.tikicdn.com/ts/product/35/94/d9/bb8738a59fda5f8e9fa774fd6a9ab5c3.jpg,0.0
544,109310241,7 Chiến Lược Thịnh Vượng Và Hạnh Phúc (Tái Bản),Jim Rohn,3.59,2.51,384,Sách kỹ năng làm việc,37,5.0,216,Nhà Xuất Bản Thế Giới,https://salt.tikicdn.com/ts/product/f7/5b/4d/0118a524e4009423e60d399b028ab171.jpg,0.3
545,204078079,"Nghĩ bình đẳng, sống bình đẳng",Nhà nhiều cột,7.26,4.35,41,Others,5,5.0,274,Nhà Xuất Bản Thế Giới,https://salt.tikicdn.com/ts/product/6c/a3/88/978e1380a0b47a37e364c29bde50763a.jpg,0.4
546,13446508,Cánh Đồng Bất Tận (Tái Bản 2019),Nguyễn Ngọc Tư,3.59,2.55,5665,Truyện ngắn - Tản văn - Tạp Văn,714,5.0,220,Unknown,https://salt.tikicdn.com/ts/product/d7/5a/54/2410e2b33f6a496f02587d9ebcff2a2f.jpg,0.29
547,69978860,Sói đội lốt Cừu - Kẻ hiếu chiến ngầm và các thủ thuật thao túng tâm lí,Bác sĩ George K. Simon,3.04,2.95,4169,Others,826,4.8,172,Nhà Xuất Bản Kinh Tế TPHCM,https://salt.tikicdn.com/ts/product/e7/e7/33/15318503c9b390eb08ae487885903a61.png,0.03
549,36363381,Sao Chúng Ta Lại Ngủ,Matthew Walker PhD,10.51,7.39,1724,Others,337,5.0,488,Nhà Xuất Bản Lao Động,https://salt.tikicdn.com/ts/product/86/d7/1f/869e64a5d697203e9449c3b94a972ff3.jpg,0.3
550,201437947,Komi - Nữ Thần Sợ Giao Tiếp - Tập 14,Tomohito Oda,1.05,1.05,239,Others,37,5.0,456,Nhà Xuất Bản Kim Đồng,https://salt.tikicdn.com/ts/product/7d/ea/f8/e89831b95bb3e38717ef7b066a937d14.jpg,0.0
551,206675362,Nâng Cao Tần Số Rung Động Mỗi Ngày: Khám Phá Cách Năng Lượng Vận Hành,Lalah Delia,5.7,5.7,67,Others,3,4.3,220,Nhà Xuất Bản Hồng Đức,https://salt.tikicdn.com/ts/product/1c/ee/b5/291fcace35051bf9562a4f362296a244.jpg,0.0
552,191045565,Cô Gái Mặc Váy Tím,Imamura Natsuko,4.01,2.41,262,Truyện ngắn - Tản văn - Tạp Văn,24,5.0,160,Nhà Xuất Bản Hà Nội,https://salt.tikicdn.com/ts/product/fd/87/d7/f3346d327283dfdf4cbce2dfe945b34f.jpg,0.4
553,168924459,Tàn Lửa,Shizukui Shusuke,7.81,4.68,749,Truyện trinh thám,148,5.0,484,Nhà Xuất Bản Hà Nội,https://salt.tikicdn.com/ts/product/8c/cd/b7/d8e35ad6df1897a4a8d638a80ced5faa.jpg,0.4
554,207852953,Blue Period - Tập 07,Yamaguchi Tsubasa,2.03,2.03,14,Others,1,5.0,192,NXB Trẻ,https://salt.tikicdn.com/ts/product/b3/69/07/aa645a4554ad29e6084a5c46cef68f86.jpg,0.0
555,38265901,Điều Quan Trọng Nhất – The Most Important Thing,Howard Marks,12.62,12.62,4356,"Sách tài chính, tiền tệ",568,4.7,378,Nhà Xuất Bản Thế Giới,https://salt.tikicdn.com/ts/product/b3/98/f3/97711a7a7a0efc3e6d3ecfae4a43655f.jpg,0.0
556,145287904,Sách - Giận (Tái Bản 2021)(Cuốn sách hay của Thiền sư Thích Nhất Hạnh/ Tặng kèm Bookmark),Unknown,5.7,5.7,3,Sách nghệ thuật sống đẹp,0,0.0,456,Nhà Xuất Bản Hồng Đức,https://salt.tikicdn.com/ts/product/da/8c/a5/9c61d93b6d2c6420169e0e1eb84104d1.jpg,0.0
